{
  "required" : true ,
  "$schema" : "http://json-schema.org/draft-03/schema" ,
  "type" : "object" ,
  "properties" : {
    "pricing_type" : {
      "type" : "string" ,
      "required" : false
    } ,
    "track_inventory" : {
      "type" : "boolean" ,
      "required" : false
    } ,
    "inventory_alert_type" : {
      "type" : "string" ,
      "required" : false
    } ,
    "id" : {
      "type" : "string" ,
      "required" : false
    } ,
    "name" : {
      "type" : "string" ,
      "required" : false
    } ,
    "price_money" : {
      "type" : "object" ,
      "required" : false ,
      "properties" : {
        "currency_code" : {
          "type" : "string" ,
          "required" : false
        } ,
        "amount" : {
          "type" : "number" ,
          "required" : false
        }
      }
    } ,
    "ordinal" : {
      "type" : "number" ,
      "required" : false
    } ,
    "item_id" : {
      "type" : "string" ,
      "required" : false
    } ,
    "inventory_alert_threshold" : {
      "type" : "number" ,
      "required" : false
    } ,
    "user_data" : {
      "type" : "string" ,
      "required" : false
    }
  }
}